{
  "id": "plugin-compiler-free",
  "name": "Prompt-to-production-plugin becomes commodity",
  "date": "2026-09-14",
  "description": "Assume OpenAI or another vendor makes MCP/plugin packaging effectively free.",
  "deltas": {
    "wrapper_risk": 1.5,
    "public_replicability": 0.8,
    "platform_capture": 0.8,
    "internalization_risk": 0.5,
    "external_state": 0.5,
    "authority": 0.5,
    "trajectories": 0.5,
    "ai_complementarity": 0.5
  },
  "notes": [
    "Do not build plugin conversion as core moat.",
    "Move value toward scarce backend state/action."
  ]
}